{
 "issues": [
  {
   "body_id": "fuselage_main",
   "observed": "The fuselage lacks the long, needle-like nose taper.",
   "patch": null,
   "proposed_change": "Extend and streamline the nose area to match the reference silhouette.",
   "severity": "major",
   "target": "Long needle-like nose taper",
   "view": "side"
  },
  {
   "body_id": "canopy",
   "observed": "The canopy is not set back enough from the nose.",
   "patch": null,
   "proposed_change": "Reposition the canopy further back along the fuselage.",
   "severity": "major",
   "target": "Bubble canopy set back from the nose",
   "view": "side"
  },
  {
   "body_id": "left_intake",
   "observed": "Left intake is not oversized and lacks clear asymmetry.",
   "patch": null,
   "proposed_change": "Increase the size of the left intake and emphasize its asymmetry.",
   "severity": "major",
   "target": "Single oversized air intake on the left flank only",
   "view": "front"
  },
  {
   "body_id": "thruster_upper",
   "observed": "Thrusters are not accurately placed on the centerline.",
   "patch": null,
   "proposed_change": "Align the thrusters properly with the centerline.",
   "severity": "major",
   "target": "Twin rear thruster nozzles on centerline",
   "view": "back"
  },
  {
   "body_id": "tail_fin",
   "observed": "The tall swept tail fin does not feature the required aft rake.",
   "patch": null,
   "proposed_change": "Adjust the tail fin to include a swept and raked design.",
   "severity": "major",
   "target": "Tall swept tail fin with aft rake",
   "view": "side"
  },
  {
   "body_id": "fuselage_main",
   "observed": "The overall shape lacks aerodynamic tapering.",
   "patch": null,
   "proposed_change": "Refine the fuselage shape to appear more aerodynamic and tapered.",
   "severity": "major",
   "target": "Streamlined one-person hover racer with a long tapered nose",
   "view": "top"
  },
  {
   "body_id": "fuselage_main",
   "observed": "length:width is 2.11",
   "patch": {
    "factor": 1.3,
    "scale_axis": 2
   },
   "proposed_change": "scale Fuselage main loft length by 1.30",
   "severity": "major",
   "target": "3.00 from the brief",
   "view": "left"
  }
 ],
 "judge_model": "openai:gpt-5+critic:gpt-4o",
 "metrics": {
  "deterministic_overall": 6.71,
  "deterministic_scores": {
   "colour_and_surface": 10.0,
   "pose_and_orientation": 8.0,
   "proportions": 5.51,
   "reference_consistency": 4.14,
   "signature_features": 7.98,
   "silhouette": 4.14
  },
  "features_named": {
   "Bubble canopy set back from the nose": true,
   "Long needle-like nose taper": false,
   "Single oversized air intake on the left flank only": true,
   "Tall swept tail fin with aft rake": true,
   "Three-point retractable landing skids (triangular stance)": true,
   "Twin rear thruster nozzles on centerline": true
  },
  "measured_proportions": {
   "height_length": 0.462,
   "length_width": 2.114
  },
  "method": "deterministic matched-view silhouette, proportion, outline-detail and palette metrics; names and labels earn no credit",
  "outline_detail_ratio": {
   "back": 0.499,
   "left": 0.445,
   "perspective": 0.478,
   "top": 0.554
  },
  "reference_silhouette_iou": {
   "back": 0.382,
   "left": 0.357,
   "perspective": 0.455,
   "top": 0.464
  },
  "silhouette_parts": [
   {
    "body_id": "canopy",
    "protrudes": true,
    "volume_share": 0.0202
   },
   {
    "body_id": "left_intake",
    "protrudes": true,
    "volume_share": 0.0065
   },
   {
    "body_id": "thruster_upper",
    "protrudes": true,
    "volume_share": 0.0054
   },
   {
    "body_id": "thruster_lower",
    "protrudes": true,
    "volume_share": 0.0054
   },
   {
    "body_id": "tail_fin",
    "protrudes": true,
    "volume_share": 0.0013
   },
   {
    "body_id": "left_strake",
    "protrudes": true,
    "volume_share": 0.0004
   },
   {
    "body_id": "right_strake",
    "protrudes": true,
    "volume_share": 0.0004
   },
   {
    "body_id": "front_skid_leg",
    "protrudes": true,
    "volume_share": 0.0002
   },
   {
    "body_id": "front_skid_foot",
    "protrudes": true,
    "volume_share": 0.0001
   },
   {
    "body_id": "rear_left_skid_leg",
    "protrudes": true,
    "volume_share": 0.0002
   },
   {
    "body_id": "rear_left_skid_foot",
    "protrudes": true,
    "volume_share": 0.0001
   },
   {
    "body_id": "rear_right_skid_leg",
    "protrudes": true,
    "volume_share": 0.0002
   },
   {
    "body_id": "rear_right_skid_foot",
    "protrudes": true,
    "volume_share": 0.0001
   }
  ],
  "target_proportions": {
   "height_length": 0.36,
   "length_width": 3.0
  }
 },
 "overall": 3.7,
 "render_digest": "c136688ad02dfe57bcdb33e26b3c7cb59d6bdf93727133d13f2bc058d656e7db",
 "scores": {
  "colour_and_surface": 3.0,
  "pose_and_orientation": 5.0,
  "proportions": 3.0,
  "reference_consistency": 4.0,
  "signature_features": 4.0,
  "silhouette": 3.0
 },
 "subjective": true,
 "summary": "The model exhibits several key elements from the brief but lacks detail and accuracy in execution. The overall silhouette and proportions are not as streamlined or aerodynamic as described. There are notable differences in shape and surface finish compared to the reference images."
}