{
 "issues": [
  {
   "body_id": "fox_core",
   "observed": "The torso shape is misshapen and not smooth or ovoid as described.",
   "patch": null,
   "proposed_change": "Refine the body to be more of a smooth, plump ovoid shape.",
   "severity": "major",
   "target": "Plump oval torso with smooth transitions",
   "view": "front"
  },
  {
   "body_id": "ear_left",
   "observed": "The ears are too conical and not integrated smoothly with the head.",
   "patch": null,
   "proposed_change": "Integrate ears more fully with the head to mimic a smooth silhouette.",
   "severity": "minor",
   "target": "Two tall, sharp-pointed ears",
   "view": "front"
  },
  {
   "body_id": "fox_core",
   "observed": "The snout is not well-defined or narrow, lacking the pronounced forward projection.",
   "patch": null,
   "proposed_change": "Refine the snout to be narrow and project forward prominently.",
   "severity": "major",
   "target": "Raised, narrow snout projecting forward",
   "view": "left"
  },
  {
   "body_id": "tail",
   "observed": "The bushy tail is incorrectly placed and does not wrap around the front paws.",
   "patch": null,
   "proposed_change": "Adjust the tail's placement and form to curl around the paws correctly.",
   "severity": "major",
   "target": "Bushy tail curling around the front paws",
   "view": "perspective"
  },
  {
   "body_id": "base_pad",
   "observed": "The base does not appear flat or recessed properly.",
   "patch": null,
   "proposed_change": "Ensure the base is flat and slightly recessed for stability.",
   "severity": "minor",
   "target": "Flat, slightly recessed base plane under haunches",
   "view": "bottom"
  },
  {
   "body_id": "fox_core",
   "observed": "Surface lacks smoothness and clear definition of body features.",
   "patch": null,
   "proposed_change": "Enhance surface smoothness and feature transitions to match the stylized look.",
   "severity": "minor",
   "target": "Smooth, stylized silhouette",
   "view": "back"
  }
 ],
 "judge_model": "openai:gpt-5+critic:gpt-4o",
 "metrics": {
  "deterministic_overall": 7.15,
  "deterministic_scores": {
   "colour_and_surface": 10.0,
   "pose_and_orientation": 8.0,
   "proportions": 7.0,
   "reference_consistency": 4.25,
   "signature_features": 8.14,
   "silhouette": 4.25
  },
  "features_named": {
   "Bushy tail curling around the front paws": true,
   "Flat, slightly recessed base plane under haunches": true,
   "Plump oval torso with smooth transitions": false,
   "Raised, narrow snout projecting forward": false,
   "Two tall, sharp-pointed ears": true
  },
  "measured_proportions": {
   "height_length": 1.21,
   "length_width": 0.781
  },
  "method": "deterministic matched-view silhouette, proportion, outline-detail and palette metrics; names and labels earn no credit",
  "outline_detail_ratio": {
   "back": 0.536,
   "left": 0.774,
   "perspective": 0.428,
   "top": 0.399
  },
  "reference_silhouette_iou": {
   "back": 0.22,
   "left": 0.553,
   "perspective": 0.407,
   "top": 0.519
  },
  "silhouette_parts": [
   {
    "body_id": "ear_left",
    "protrudes": true,
    "volume_share": 0.0093
   },
   {
    "body_id": "ear_right",
    "protrudes": true,
    "volume_share": 0.0093
   },
   {
    "body_id": "front_paws",
    "protrudes": true,
    "volume_share": 0.0202
   },
   {
    "body_id": "tail",
    "protrudes": true,
    "volume_share": 0.1072
   },
   {
    "body_id": "base_pad",
    "protrudes": true,
    "volume_share": 0.0383
   }
  ],
  "target_proportions": {}
 },
 "overall": 3.7,
 "render_digest": "84e0236acda0b6634a60c836ca85fc5b75a6b07f113d1a53858aceb650fdee89",
 "scores": {
  "colour_and_surface": 5.0,
  "pose_and_orientation": 4.0,
  "proportions": 4.0,
  "reference_consistency": 3.0,
  "signature_features": 3.0,
  "silhouette": 3.0
 },
 "subjective": true,
 "summary": "The generated geometry shows some foundational work towards the intended stylized fox figurine but requires significant refinement to meet the brief fully. The proportions and features do not closely align with the reference images."
}