{
 "issues": [
  {
   "body_id": "canopy",
   "observed": "Canopy is very simplified and not set back as in the reference.",
   "patch": null,
   "proposed_change": "Refine the canopy to be more spherical and correctly positioned.",
   "severity": "major",
   "target": "Canopy should accurately depict a bubble shape set back from the nose as described.",
   "view": "perspective"
  },
  {
   "body_id": "intake_bulge",
   "observed": "Intake appears less pronounced than the reference.",
   "patch": null,
   "proposed_change": "Increase the size and distinctiveness of the intake.",
   "severity": "major",
   "target": "A single oversized air intake on the left flank.",
   "view": "left"
  },
  {
   "body_id": "tail_fin",
   "observed": "Tail fin is too simplistic and lacks the correct sweep and detail.",
   "patch": null,
   "proposed_change": "Adjust the tail fin to match the description of a tall, swept design with aft rake.",
   "severity": "major",
   "target": "The tail fin should exhibit a tall swept profile with more defined edges.",
   "view": "back"
  },
  {
   "body_id": null,
   "observed": "Silhouette lacks finesse and detail; there are excessive simplifications.",
   "patch": null,
   "proposed_change": "Ensure the silhouette accurately reflects the detailed taper and overall streamlined form.",
   "severity": "critical",
   "target": "Long needle-like nose taper and precise silhouette profile.",
   "view": "top"
  },
  {
   "body_id": null,
   "observed": "Color scheme doesn't match the specified palette.",
   "patch": null,
   "proposed_change": "Apply the specified colors to enhance realism and visual match.",
   "severity": "minor",
   "target": "Graphite Composite, Hypersilver Accent, Neon Cyan Trim, Hazard Yellow Markings, Thruster Glow Orange.",
   "view": "color"
  },
  {
   "body_id": "fuselage",
   "observed": "height:length is 0.27",
   "patch": {
    "factor": 1.3,
    "scale_axis": 1
   },
   "proposed_change": "scale Fuselage shell height by 1.30",
   "severity": "major",
   "target": "0.36 from the brief",
   "view": "front"
  }
 ],
 "judge_model": "openai:gpt-5+critic:gpt-4o",
 "metrics": {
  "deterministic_overall": 7.34,
  "deterministic_scores": {
   "colour_and_surface": 10.0,
   "pose_and_orientation": 8.0,
   "proportions": 7.52,
   "reference_consistency": 4.76,
   "signature_features": 7.87,
   "silhouette": 4.76
  },
  "features_named": {
   "Bubble canopy set back from the nose": true,
   "Long needle-like nose taper": true,
   "Single oversized air intake on the left flank only": true,
   "Tall swept tail fin with aft rake": true,
   "Three-point retractable landing skids (triangular stance)": true,
   "Twin rear thruster nozzles on centerline": true
  },
  "measured_proportions": {
   "height_length": 0.273,
   "length_width": 3.111
  },
  "method": "deterministic matched-view silhouette, proportion, outline-detail and palette metrics; names and labels earn no credit",
  "outline_detail_ratio": {
   "back": 0.508,
   "left": 0.418,
   "perspective": 0.366,
   "top": 0.578
  },
  "reference_silhouette_iou": {
   "back": 0.45,
   "left": 0.418,
   "perspective": 0.472,
   "top": 0.564
  },
  "silhouette_parts": [
   {
    "body_id": "canopy",
    "protrudes": true,
    "volume_share": 0.0609
   },
   {
    "body_id": "intake_tube",
    "protrudes": true,
    "volume_share": 0.0059
   },
   {
    "body_id": "intake_bulge",
    "protrudes": true,
    "volume_share": 0.0152
   },
   {
    "body_id": "tail_fin",
    "protrudes": true,
    "volume_share": 0.0061
   },
   {
    "body_id": "right_strake",
    "protrudes": true,
    "volume_share": 0.0033
   },
   {
    "body_id": "left_strake",
    "protrudes": true,
    "volume_share": 0.0033
   },
   {
    "body_id": "nozzle_upper",
    "protrudes": true,
    "volume_share": 0.0059
   },
   {
    "body_id": "nozzle_lower",
    "protrudes": true,
    "volume_share": 0.0059
   },
   {
    "body_id": "nozzle_glow_upper",
    "protrudes": true,
    "volume_share": 0.0014
   },
   {
    "body_id": "nozzle_glow_lower",
    "protrudes": true,
    "volume_share": 0.0014
   },
   {
    "body_id": "tail_heat_shield",
    "protrudes": true,
    "volume_share": 0.0018
   },
   {
    "body_id": "nose_skid_foot",
    "protrudes": true,
    "volume_share": 0.0003
   },
   {
    "body_id": "rear_left_skid_foot",
    "protrudes": true,
    "volume_share": 0.0003
   },
   {
    "body_id": "rear_right_skid_foot",
    "protrudes": true,
    "volume_share": 0.0003
   },
   {
    "body_id": "nose_skid_leg",
    "protrudes": true,
    "volume_share": 0.0004
   },
   {
    "body_id": "rear_left_skid_leg",
    "protrudes": true,
    "volume_share": 0.0004
   },
   {
    "body_id": "rear_right_skid_leg",
    "protrudes": true,
    "volume_share": 0.0004
   },
   {
    "body_id": "lift_ports_front",
    "protrudes": true,
    "volume_share": 0.0005
   },
   {
    "body_id": "lift_ports_rear",
    "protrudes": true,
    "volume_share": 0.0004
   }
  ],
  "target_proportions": {
   "height_length": 0.36,
   "length_width": 3.0
  }
 },
 "overall": 5.3,
 "render_digest": "719af587d9aaa2917296e6949aa4f70e11bc5269e308a4c0e77f3c5d3380fb52",
 "scores": {
  "colour_and_surface": 4.0,
  "pose_and_orientation": 6.0,
  "proportions": 5.0,
  "reference_consistency": 5.0,
  "signature_features": 6.0,
  "silhouette": 6.0
 },
 "subjective": true,
 "summary": "The generated render matches some features of the reference but lacks detail and fidelity in others. The general shape and configuration reflect the brief, but there are issues in proportions and color execution."
}