{
 "issues": [
  {
   "body_id": "fuselage",
   "observed": "The fuselage appears too bulky and not as streamlined as described. The long, tapered appearance is not accurately captured.",
   "patch": null,
   "proposed_change": "Refine the fuselage to be more elongated and streamlined to reflect high speed.",
   "severity": "major",
   "target": "Express high speed and agility through a long, tapered fuselage",
   "view": "all"
  },
  {
   "body_id": "intake_bulge",
   "observed": "The intake bulge is not sufficiently exaggerated or distinctive in appearance.",
   "patch": null,
   "proposed_change": "Increase the size and prominence of the intake bulge.",
   "severity": "major",
   "target": "Feature deliberate asymmetry via a single left-flank intake",
   "view": "left"
  },
  {
   "body_id": "tail_fin",
   "observed": "The tail fin is not as tall or swept back as needed.",
   "patch": null,
   "proposed_change": "Redesign the tail fin to be taller and more swept.",
   "severity": "major",
   "target": "Tall swept tail fin with aft rake",
   "view": "all"
  },
  {
   "body_id": "canopy",
   "observed": "The canopy is not distinctly set back from the nose.",
   "patch": null,
   "proposed_change": "Reposition the canopy further back on the fuselage.",
   "severity": "minor",
   "target": "Bubble canopy set back from the nose",
   "view": "top"
  },
  {
   "body_id": "nozzle_upper",
   "observed": "The twin rear thruster nozzles appear undersized and lack detail.",
   "patch": null,
   "proposed_change": "Enlarge the nozzles and add more detail to match specifications.",
   "severity": "critical",
   "target": "Twin rear thruster nozzles on centerline",
   "view": "back"
  },
  {
   "body_id": "fuselage",
   "observed": "height:length is 0.27",
   "patch": {
    "factor": 1.3,
    "scale_axis": 1
   },
   "proposed_change": "scale Fuselage shell height by 1.30",
   "severity": "major",
   "target": "0.36 from the brief",
   "view": "front"
  }
 ],
 "judge_model": "openai:gpt-5+critic:gpt-4o",
 "metrics": {
  "deterministic_overall": 7.32,
  "deterministic_scores": {
   "colour_and_surface": 10.0,
   "pose_and_orientation": 8.0,
   "proportions": 7.52,
   "reference_consistency": 4.62,
   "signature_features": 7.94,
   "silhouette": 4.62
  },
  "features_named": {
   "Bubble canopy set back from the nose": true,
   "Long needle-like nose taper": true,
   "Single oversized air intake on the left flank only": true,
   "Tall swept tail fin with aft rake": true,
   "Three-point retractable landing skids (triangular stance)": true,
   "Twin rear thruster nozzles on centerline": true
  },
  "measured_proportions": {
   "height_length": 0.273,
   "length_width": 3.111
  },
  "method": "deterministic matched-view silhouette, proportion, outline-detail and palette metrics; names and labels earn no credit",
  "outline_detail_ratio": {
   "back": 0.552,
   "left": 0.476,
   "perspective": 0.438,
   "top": 0.47
  },
  "reference_silhouette_iou": {
   "back": 0.457,
   "left": 0.372,
   "perspective": 0.451,
   "top": 0.567
  },
  "silhouette_parts": [
   {
    "body_id": "canopy",
    "protrudes": true,
    "volume_share": 0.0609
   },
   {
    "body_id": "intake_tube",
    "protrudes": true,
    "volume_share": 0.0059
   },
   {
    "body_id": "intake_bulge",
    "protrudes": true,
    "volume_share": 0.0152
   },
   {
    "body_id": "tail_fin",
    "protrudes": true,
    "volume_share": 0.0061
   },
   {
    "body_id": "right_strake",
    "protrudes": true,
    "volume_share": 0.0033
   },
   {
    "body_id": "left_strake",
    "protrudes": true,
    "volume_share": 0.0033
   },
   {
    "body_id": "nozzle_upper",
    "protrudes": true,
    "volume_share": 0.0059
   },
   {
    "body_id": "nozzle_lower",
    "protrudes": true,
    "volume_share": 0.0059
   },
   {
    "body_id": "nozzle_glow_upper",
    "protrudes": true,
    "volume_share": 0.0014
   },
   {
    "body_id": "nozzle_glow_lower",
    "protrudes": true,
    "volume_share": 0.0014
   },
   {
    "body_id": "tail_heat_shield",
    "protrudes": true,
    "volume_share": 0.0018
   },
   {
    "body_id": "nose_skid_foot",
    "protrudes": true,
    "volume_share": 0.0003
   },
   {
    "body_id": "rear_left_skid_foot",
    "protrudes": true,
    "volume_share": 0.0003
   },
   {
    "body_id": "rear_right_skid_foot",
    "protrudes": true,
    "volume_share": 0.0003
   },
   {
    "body_id": "nose_skid_leg",
    "protrudes": true,
    "volume_share": 0.0004
   },
   {
    "body_id": "rear_left_skid_leg",
    "protrudes": true,
    "volume_share": 0.0004
   },
   {
    "body_id": "rear_right_skid_leg",
    "protrudes": true,
    "volume_share": 0.0004
   },
   {
    "body_id": "lift_ports_front",
    "protrudes": true,
    "volume_share": 0.0005
   },
   {
    "body_id": "lift_ports_rear",
    "protrudes": true,
    "volume_share": 0.0004
   },
   {
    "body_id": "tail_fin_starboard",
    "protrudes": true,
    "volume_share": 0.0017
   }
  ],
  "target_proportions": {
   "height_length": 0.36,
   "length_width": 3.0
  }
 },
 "overall": 6.0,
 "render_digest": "1797992f3f30df6c875198d4dc4f360a8c5629bb0d4800ce956abba4fd693065",
 "scores": {
  "colour_and_surface": 7.0,
  "pose_and_orientation": 6.0,
  "proportions": 6.0,
  "reference_consistency": 5.0,
  "signature_features": 5.0,
  "silhouette": 7.0
 },
 "subjective": true,
 "summary": "The render captures the basic form of the hover racer but lacks some of the key details and proportions described in the brief."
}