{
 "issues": [
  {
   "body_id": "fox_core",
   "observed": "Blocky, overly rigid silhouette.",
   "patch": null,
   "proposed_change": "Refine shape for smooth transitions.",
   "severity": "major",
   "target": "Smooth, stylized silhouette",
   "view": "front"
  },
  {
   "body_id": "fox_core",
   "observed": "Features are too angular and misplaced.",
   "patch": null,
   "proposed_change": "Adjust snout and ears for accuracy and smoothness.",
   "severity": "critical",
   "target": "Organically positioned features",
   "view": "left"
  },
  {
   "body_id": "fox_core",
   "observed": "Proportions are off; head and snout too large.",
   "patch": null,
   "proposed_change": "Redesign to achieve correct proportion scale.",
   "severity": "major",
   "target": "Balanced proportions with plump body",
   "view": "perspective"
  },
  {
   "body_id": "fox_core",
   "observed": "Orientation of snout and ears doesn't align with reference.",
   "patch": null,
   "proposed_change": "Realign the snout and re-scale ears.",
   "severity": "major",
   "target": "Proper alignment of snout and ears",
   "view": "top"
  },
  {
   "body_id": "fox_core",
   "observed": "Fox tail lacks proper integration with body.",
   "patch": null,
   "proposed_change": "Integrate tail smoothly into body structure.",
   "severity": "minor",
   "target": "Tail curls around body",
   "view": "back"
  },
  {
   "body_id": "fox_core",
   "observed": "Overall finish appears rough and polygonal.",
   "patch": null,
   "proposed_change": "Increase mesh density for smoother finish.",
   "severity": "minor",
   "target": "Smooth surface finish",
   "view": "top"
  }
 ],
 "judge_model": "openai:gpt-5+critic:gpt-4o",
 "metrics": {
  "deterministic_overall": 6.27,
  "deterministic_scores": {
   "colour_and_surface": 10.0,
   "pose_and_orientation": 8.0,
   "proportions": 7.0,
   "reference_consistency": 5.6,
   "signature_features": 3.27,
   "silhouette": 5.6
  },
  "features_named": {
   "Bushy tail curling around the front paws": true,
   "Flat, slightly recessed base plane under haunches": true,
   "Plump oval torso with smooth transitions": true,
   "Raised, narrow snout projecting forward": false,
   "Two tall, sharp-pointed ears": true
  },
  "measured_proportions": {
   "height_length": 1.963,
   "length_width": 0.854
  },
  "method": "deterministic matched-view silhouette, proportion, outline-detail and palette metrics; names and labels earn no credit",
  "outline_detail_ratio": {
   "back": 0.713,
   "left": 0.704,
   "perspective": 0.378,
   "top": 0.269
  },
  "reference_silhouette_iou": {
   "back": 0.549,
   "left": 0.637,
   "perspective": 0.412,
   "top": 0.641
  },
  "silhouette_parts": [
   {
    "body_id": "base_pad",
    "protrudes": true,
    "volume_share": 0.0269
   }
  ],
  "target_proportions": {}
 },
 "overall": 5.0,
 "render_digest": "a5028b43f1181acc8342726bf7959b274c939a4dc9dac2df159ccede4150e23f",
 "scores": {
  "colour_and_surface": 5.0,
  "pose_and_orientation": 7.0,
  "proportions": 6.0,
  "reference_consistency": 4.0,
  "signature_features": 4.0,
  "silhouette": 5.0
 },
 "subjective": true,
 "summary": "The render shows some alignment with the brief but has significant deviations in key areas."
}