{
 "issues": [
  {
   "body_id": "fox_core",
   "observed": "Snout appears overly thick and less refined.",
   "patch": null,
   "proposed_change": "Refine and narrow the snout to better match the reference image.",
   "severity": "major",
   "target": "Raised, narrow snout projecting forward.",
   "view": "front"
  },
  {
   "body_id": "fox_core",
   "observed": "Body lacks smooth, stylized plumpness.",
   "patch": null,
   "proposed_change": "Smooth out transitions and ensure a more ovoid body shape.",
   "severity": "major",
   "target": "Plump oval torso with smooth transitions.",
   "view": "top"
  },
  {
   "body_id": "fox_core",
   "observed": "Ear shapes are too angular and thick.",
   "patch": null,
   "proposed_change": "Refine ear shapes to be pointed and slightly thinner.",
   "severity": "major",
   "target": "Two tall, sharp-pointed ears.",
   "view": "perspective"
  },
  {
   "body_id": "fox_core",
   "observed": "Tail does not seamlessly blend with the body.",
   "patch": null,
   "proposed_change": "Ensure the tail smoothly integrates with the body and curls naturally.",
   "severity": "minor",
   "target": "Bushy tail curling around the front paws.",
   "view": "right"
  }
 ],
 "judge_model": "openai:gpt-5+critic:gpt-4o",
 "metrics": {
  "deterministic_overall": 6.28,
  "deterministic_scores": {
   "colour_and_surface": 10.0,
   "pose_and_orientation": 8.0,
   "proportions": 7.0,
   "reference_consistency": 5.58,
   "signature_features": 3.34,
   "silhouette": 5.58
  },
  "features_named": {
   "Bushy tail curling around the front paws": true,
   "Flat, slightly recessed base plane under haunches": true,
   "Plump oval torso with smooth transitions": true,
   "Raised, narrow snout projecting forward": false,
   "Two tall, sharp-pointed ears": true
  },
  "measured_proportions": {
   "height_length": 1.898,
   "length_width": 0.856
  },
  "method": "deterministic matched-view silhouette, proportion, outline-detail and palette metrics; names and labels earn no credit",
  "outline_detail_ratio": {
   "back": 0.753,
   "left": 0.748,
   "perspective": 0.374,
   "top": 0.267
  },
  "reference_silhouette_iou": {
   "back": 0.548,
   "left": 0.621,
   "perspective": 0.422,
   "top": 0.641
  },
  "silhouette_parts": [
   {
    "body_id": "base_pad",
    "protrudes": true,
    "volume_share": 0.0278
   }
  ],
  "target_proportions": {}
 },
 "overall": 5.7,
 "render_digest": "57510cd197c1126ab256b6a26e0ef3dc5a4756786b7b5e040754607673430224",
 "scores": {
  "colour_and_surface": 7.0,
  "pose_and_orientation": 7.0,
  "proportions": 5.0,
  "reference_consistency": 5.0,
  "signature_features": 4.0,
  "silhouette": 6.0
 },
 "subjective": true,
 "summary": "The render captures the basic posture and color palette but lacks refinement in silhouette and proportions, with some issues in signature features and reference consistency."
}