{
 "issues": [
  {
   "body_id": "dome_cap",
   "observed": "The dome is rendered in black instead of polished steel.",
   "patch": null,
   "proposed_change": "Change the dome color to polished steel.",
   "severity": "major",
   "target": "Polished steel",
   "view": "front"
  },
  {
   "body_id": "crank_arm",
   "observed": "The crank arm is black instead of metal.",
   "patch": null,
   "proposed_change": "Set the crank arm texture to a metallic finish.",
   "severity": "major",
   "target": "Stainless steel",
   "view": "perspective"
  },
  {
   "body_id": "badge_plate",
   "observed": "The badge is missing from the front.",
   "patch": null,
   "proposed_change": "Add the badge with a placeholder logo.",
   "severity": "critical",
   "target": "Present with logo",
   "view": "front"
  },
  {
   "body_id": "drawer_knob_cap",
   "observed": "The drawer knob is not present in the render.",
   "patch": null,
   "proposed_change": "Include the round metal knob on the drawer.",
   "severity": "major",
   "target": "Round metal pull knob",
   "view": "front"
  },
  {
   "body_id": "box_body",
   "observed": "The box looks blocky rather than with rounded edges.",
   "patch": null,
   "proposed_change": "Modify the box to have rounded edges as per reference.",
   "severity": "minor",
   "target": "Rounded edges",
   "view": "front"
  },
  {
   "body_id": "crank_hub",
   "observed": "The central spindle and nut are missing details.",
   "patch": null,
   "proposed_change": "Refine rendering of the central spindle with detailed adjustment nut.",
   "severity": "major",
   "target": "Detailed adjustment spindle",
   "view": "top"
  }
 ],
 "judge_model": "openai:gpt-5+critic:gpt-4o",
 "metrics": {
  "deterministic_overall": 7.42,
  "deterministic_scores": {
   "colour_and_surface": 10.0,
   "pose_and_orientation": 8.0,
   "proportions": 7.0,
   "reference_consistency": 5.56,
   "signature_features": 7.93,
   "silhouette": 5.56
  },
  "features_named": {
   "Exposed screws around the dome flange": true,
   "Front pull-out drawer with round metal pull": true,
   "Polished metal dome lid with central spindle": true,
   "Side crank arm with spherical wooden knob": true,
   "Small badge/logo on the front face": true,
   "Square wooden box body with rounded edges": true
  },
  "measured_proportions": {
   "height_length": 1.035,
   "length_width": 1.15
  },
  "method": "deterministic matched-view silhouette, proportion, outline-detail and palette metrics; names and labels earn no credit",
  "outline_detail_ratio": {
   "back": 0.838,
   "left": 0.56,
   "perspective": 0.163,
   "top": 0.367
  },
  "reference_silhouette_iou": {
   "back": 0.393,
   "left": 0.637,
   "perspective": 0.596,
   "top": 0.597
  },
  "silhouette_parts": [
   {
    "body_id": "box_body",
    "protrudes": true,
    "volume_share": 5.9578
   },
   {
    "body_id": "top_plate",
    "protrudes": true,
    "volume_share": 1.1667
   },
   {
    "body_id": "flange_ring",
    "protrudes": true,
    "volume_share": 0.1475
   },
   {
    "body_id": "dome_cap",
    "protrudes": true,
    "volume_share": 0.8812
   },
   {
    "body_id": "spindle_collar",
    "protrudes": true,
    "volume_share": 0.0334
   },
   {
    "body_id": "spindle_post",
    "protrudes": true,
    "volume_share": 0.0088
   },
   {
    "body_id": "crank_hub",
    "protrudes": true,
    "volume_share": 0.017
   },
   {
    "body_id": "crank_arm",
    "protrudes": true,
    "volume_share": 0.0418
   },
   {
    "body_id": "knob_stem",
    "protrudes": true,
    "volume_share": 0.0069
   },
   {
    "body_id": "knob_ball",
    "protrudes": true,
    "volume_share": 0.1609
   },
   {
    "body_id": "lock_nut",
    "protrudes": true,
    "volume_share": 0.0077
   },
   {
    "body_id": "hinge_pin",
    "protrudes": true,
    "volume_share": 0.0011
   },
   {
    "body_id": "fill_flap",
    "protrudes": true,
    "volume_share": 0.0045
   },
   {
    "body_id": "drawer_box",
    "protrudes": true,
    "volume_share": 1.7042
   },
   {
    "body_id": "drawer_front_panel",
    "protrudes": true,
    "volume_share": 0.2663
   },
   {
    "body_id": "drawer_knob_stem",
    "protrudes": true,
    "volume_share": 0.0049
   },
   {
    "body_id": "drawer_knob_cap",
    "protrudes": true,
    "volume_share": 0.02
   },
   {
    "body_id": "badge_plate",
    "protrudes": true,
    "volume_share": 0.0109
   },
   {
    "body_id": "flange_screw_1",
    "protrudes": true,
    "volume_share": 0.0003
   },
   {
    "body_id": "flange_screw_2",
    "protrudes": true,
    "volume_share": 0.0003
   },
   {
    "body_id": "flange_screw_3",
    "protrudes": true,
    "volume_share": 0.0003
   },
   {
    "body_id": "flange_screw_4",
    "protrudes": true,
    "volume_share": 0.0003
   },
   {
    "body_id": "corner_screw_fl",
    "protrudes": true,
    "volume_share": 0.0004
   },
   {
    "body_id": "corner_screw_fr",
    "protrudes": true,
    "volume_share": 0.0004
   },
   {
    "body_id": "corner_screw_bl",
    "protrudes": true,
    "volume_share": 0.0004
   },
   {
    "body_id": "corner_screw_br",
    "protrudes": true,
    "volume_share": 0.0004
   },
   {
    "body_id": "lower_burr",
    "protrudes": true,
    "volume_share": 0.3084
   },
   {
    "body_id": "upper_burr",
    "protrudes": true,
    "volume_share": 0.2213
   }
  ],
  "target_proportions": {}
 },
 "overall": 5.0,
 "render_digest": "4936c70cc8a5d74e28644d1b4b7362759d66d3fe61682722b85b1b066a0fe9f8",
 "scores": {
  "colour_and_surface": 3.0,
  "pose_and_orientation": 7.0,
  "proportions": 6.0,
  "reference_consistency": 4.0,
  "signature_features": 4.0,
  "silhouette": 5.0
 },
 "subjective": true,
 "summary": "The render captures the basic form and pose of the vintage hand-crank coffee grinder but lacks in several key areas. Proportions are somewhat consistent with the reference, but the detailed features and color accuracy need improvement."
}