{
 "issues": [
  {
   "body_id": "dome",
   "observed": "Dome shape is too conical.",
   "patch": null,
   "proposed_change": "Adjust dome geometry to be flatter and more rounded like the reference.",
   "severity": "critical",
   "target": "Dome should be more rounded.",
   "view": "front"
  },
  {
   "body_id": "crank_arm",
   "observed": "Crank length is too disproportionate and thick.",
   "patch": null,
   "proposed_change": "Adjust crank arm to be thinner and aligned properly to avoid overlapping with the central spindle visually.",
   "severity": "critical",
   "target": "Crank should be slimmer and positioned lower.",
   "view": "front"
  },
  {
   "body_id": "box_body",
   "observed": "Lack of surface detail and edge definition.",
   "patch": null,
   "proposed_change": "Add texture to the box body surface and sharpen the edges to match the reference.",
   "severity": "major",
   "target": "Box body should show wood grain texture and more defined edges.",
   "view": "front"
  },
  {
   "body_id": "top_plate",
   "observed": "Top plate lacks mounting screws.",
   "patch": null,
   "proposed_change": "Model the screws on the top plate around the dome flange similar to the reference.",
   "severity": "minor",
   "target": "Screws should be visible around the dome flange.",
   "view": "perspective"
  },
  {
   "body_id": "badge_plate",
   "observed": "Missing branding badge on the front.",
   "patch": null,
   "proposed_change": "Include the badge/logo on the front face of the box body above the drawer.",
   "severity": "minor",
   "target": "Reference shows a badge/logo above the drawer.",
   "view": "perspective"
  },
  {
   "body_id": "crank_arm",
   "observed": "Crank orientation is misaligned in perspective view.",
   "patch": null,
   "proposed_change": "Position the crank arm horizontally and adjust the knob to match the original's position.",
   "severity": "major",
   "target": "Crank should align horizontally when viewed in perspective.",
   "view": "perspective"
  }
 ],
 "judge_model": "openai:gpt-5+critic:gpt-4o",
 "metrics": {
  "deterministic_overall": 7.75,
  "deterministic_scores": {
   "colour_and_surface": 10.0,
   "pose_and_orientation": 8.0,
   "proportions": 7.0,
   "reference_consistency": 6.73,
   "signature_features": 8.09,
   "silhouette": 6.73
  },
  "features_named": {
   "Exposed screws around the dome flange": true,
   "Front pull-out drawer with round metal pull": true,
   "Polished metal dome lid with central spindle": true,
   "Side crank arm with spherical wooden knob": true,
   "Small badge/logo on the front face": true,
   "Square wooden box body with rounded edges": true
  },
  "measured_proportions": {
   "height_length": 1.451,
   "length_width": 0.97
  },
  "method": "deterministic matched-view silhouette, proportion, outline-detail and palette metrics; names and labels earn no credit",
  "outline_detail_ratio": {
   "back": 0.816,
   "left": 0.589,
   "perspective": 0.208,
   "top": 0.474
  },
  "reference_silhouette_iou": {
   "back": 0.546,
   "left": 0.774,
   "perspective": 0.663,
   "top": 0.708
  },
  "silhouette_parts": [
   {
    "body_id": "box_body",
    "protrudes": true,
    "volume_share": 6.3802
   },
   {
    "body_id": "top_plate",
    "protrudes": true,
    "volume_share": 1.0
   },
   {
    "body_id": "dome_ring",
    "protrudes": true,
    "volume_share": 0.1402
   },
   {
    "body_id": "dome",
    "protrudes": true,
    "volume_share": 0.8337
   },
   {
    "body_id": "shaft_collar",
    "protrudes": true,
    "volume_share": 0.0198
   },
   {
    "body_id": "spindle_shaft",
    "protrudes": true,
    "volume_share": 0.0098
   },
   {
    "body_id": "crank_arm",
    "protrudes": true,
    "volume_share": 0.0854
   },
   {
    "body_id": "spindle_cap_nut",
    "protrudes": true,
    "volume_share": 0.01
   },
   {
    "body_id": "knob_stem",
    "protrudes": true,
    "volume_share": 0.0033
   },
   {
    "body_id": "knob_wood",
    "protrudes": true,
    "volume_share": 0.07
   },
   {
    "body_id": "drawer_front",
    "protrudes": true,
    "volume_share": 0.1647
   },
   {
    "body_id": "drawer_knob_stem",
    "protrudes": true,
    "volume_share": 0.0041
   },
   {
    "body_id": "drawer_knob_cap",
    "protrudes": true,
    "volume_share": 0.0139
   },
   {
    "body_id": "badge_plate",
    "protrudes": true,
    "volume_share": 0.009
   },
   {
    "body_id": "ring_screw_n",
    "protrudes": true,
    "volume_share": 0.0003
   },
   {
    "body_id": "ring_screw_s",
    "protrudes": true,
    "volume_share": 0.0003
   },
   {
    "body_id": "ring_screw_e",
    "protrudes": true,
    "volume_share": 0.0003
   },
   {
    "body_id": "ring_screw_w",
    "protrudes": true,
    "volume_share": 0.0003
   },
   {
    "body_id": "wood_screw_ne",
    "protrudes": true,
    "volume_share": 0.0003
   },
   {
    "body_id": "wood_screw_nw",
    "protrudes": true,
    "volume_share": 0.0003
   },
   {
    "body_id": "wood_screw_se",
    "protrudes": true,
    "volume_share": 0.0003
   },
   {
    "body_id": "wood_screw_sw",
    "protrudes": true,
    "volume_share": 0.0003
   },
   {
    "body_id": "bean_lid",
    "protrudes": true,
    "volume_share": 0.0039
   },
   {
    "body_id": "bean_tab",
    "protrudes": true,
    "volume_share": 0.0005
   }
  ],
  "target_proportions": {}
 },
 "overall": 5.0,
 "render_digest": "c7e2708480710efc01d372a32d0417ceb7e3b39d69c985ad0a47dad826645a21",
 "scores": {
  "colour_and_surface": 4.0,
  "pose_and_orientation": 8.0,
  "proportions": 5.0,
  "reference_consistency": 5.0,
  "signature_features": 6.0,
  "silhouette": 7.0
 },
 "subjective": true,
 "summary": "The render attempts to replicate the vintage coffee grinder but misses key details and proportion accuracy."
}