{
 "issues": [
  {
   "body_id": "body_core",
   "observed": "Proportions seem slightly off; the camera height appears more exaggerated compared to the width than specified.",
   "patch": null,
   "proposed_change": "Adjust the camera's height to achieve better adherence to the specified width_height ratio.",
   "severity": "major",
   "target": "Maintain width_height ratio of 1.71.",
   "view": "front"
  },
  {
   "body_id": null,
   "observed": "Color and surface textures are not well defined, making it hard to distinguish the materials used.",
   "patch": null,
   "proposed_change": "Enhance material textures and colors to match the intended palette more accurately.",
   "severity": "minor",
   "target": "Palette of Matte Black Body, Charcoal Rubber Grip, Brushed Silver Accents, and Indicator Orange.",
   "view": "perspective"
  },
  {
   "body_id": "dial_left",
   "observed": "Dial placement might interfere with finger clearance.",
   "patch": null,
   "proposed_change": "Reposition the dial slightly to ensure adequate clearance and alignment with the brief's specifications.",
   "severity": "minor",
   "target": "Knurled dial requires ~1.5\u20132.0 mm knurl depth and 2 mm edge clearance to avoid finger rub.",
   "view": "top"
  }
 ],
 "judge_model": "openai:gpt-5+critic:gpt-4o",
 "metrics": {
  "deterministic_overall": 7.9,
  "deterministic_scores": {
   "colour_and_surface": 10.0,
   "pose_and_orientation": 8.0,
   "proportions": 7.0,
   "reference_consistency": 7.05,
   "signature_features": 8.34,
   "silhouette": 7.05
  },
  "features_named": {
   "Centered ISO-518 hot shoe on top plate": true,
   "Front viewfinder window at top-left": true,
   "Large knurled top dial": true,
   "Left-only textured rubber grip panel": true,
   "Right-offset cylindrical lens barrel": true,
   "Right-side hinged port door": true
  },
  "measured_proportions": {
   "height_length": 1.112,
   "length_width": 0.618
  },
  "method": "deterministic matched-view silhouette, proportion, outline-detail and palette metrics; names and labels earn no credit",
  "outline_detail_ratio": {
   "back": 0.746,
   "left": 0.382,
   "perspective": 0.722,
   "top": 0.489
  },
  "reference_silhouette_iou": {
   "back": 0.81,
   "left": 0.653,
   "perspective": 0.79,
   "top": 0.569
  },
  "silhouette_parts": [
   {
    "body_id": "top_plate",
    "protrudes": true,
    "volume_share": 0.1111
   },
   {
    "body_id": "bottom_plate",
    "protrudes": true,
    "volume_share": 0.101
   },
   {
    "body_id": "left_grip",
    "protrudes": true,
    "volume_share": 0.0297
   },
   {
    "body_id": "lens_barrel",
    "protrudes": true,
    "volume_share": 0.1732
   },
   {
    "body_id": "lens_glass",
    "protrudes": true,
    "volume_share": 0.0216
   },
   {
    "body_id": "viewfinder_bezel",
    "protrudes": true,
    "volume_share": 0.0022
   },
   {
    "body_id": "viewfinder_glass",
    "protrudes": true,
    "volume_share": 0.0008
   },
   {
    "body_id": "dial_left",
    "protrudes": true,
    "volume_share": 0.0129
   },
   {
    "body_id": "dial_right",
    "protrudes": true,
    "volume_share": 0.0082
   },
   {
    "body_id": "hot_shoe",
    "protrudes": true,
    "volume_share": 0.0097
   },
   {
    "body_id": "rear_screen",
    "protrudes": true,
    "volume_share": 0.0671
   },
   {
    "body_id": "port_door",
    "protrudes": true,
    "volume_share": 0.0148
   }
  ],
  "target_proportions": {}
 },
 "overall": 7.0,
 "render_digest": "7960ec3a6fb6a8fec66fb8140c83f1d8e9a7a4ad1a6fa13623f863b025547e10",
 "scores": {
  "colour_and_surface": 5.0,
  "pose_and_orientation": 9.0,
  "proportions": 6.0,
  "reference_consistency": 7.0,
  "signature_features": 8.0,
  "silhouette": 7.0
 },
 "subjective": true,
 "summary": "The rendered geometry generally aligns with the brief's specifications, showcasing the core features like the right-offset lens barrel, left-only grip, and top dials. The silhouette resembles the boxy, compact design expected for a rangefinder-style camera. However, there are issues with proportions and the clarity of materials used in the render, which detracts from the visual accuracy."
}