{
 "issues": [
  {
   "body_id": "dial_right",
   "observed": "Two dials present on top plate.",
   "patch": null,
   "proposed_change": "Remove right dial (secondary).",
   "severity": "major",
   "target": "Single large knurled top dial",
   "view": "top"
  },
  {
   "body_id": "top_plate",
   "observed": "Color does not match the reference matte black.",
   "patch": null,
   "proposed_change": "Adjust color to match matte black.",
   "severity": "minor",
   "target": "Matte Black Body",
   "view": "front"
  },
  {
   "body_id": "hot_shoe",
   "observed": "Hot shoe lacks the brushed silver accents.",
   "patch": null,
   "proposed_change": "Add brushed silver finish to hot shoe.",
   "severity": "minor",
   "target": "Brushed Silver Accents",
   "view": "top"
  },
  {
   "body_id": "viewfinder_bezel",
   "observed": "Viewfinder window color does not align with reference.",
   "patch": null,
   "proposed_change": "Adjust viewfinder bezel to match body color.",
   "severity": "minor",
   "target": "Matte Black Body",
   "view": "front"
  },
  {
   "body_id": "lens_barrel",
   "observed": "Lens barrel color deviates slightly from reference.",
   "patch": null,
   "proposed_change": "Align lens barrel color with reference.",
   "severity": "minor",
   "target": "Matte Black Body",
   "view": "perspective"
  },
  {
   "body_id": "port_door",
   "observed": "The right-side port door is not modeled.",
   "patch": null,
   "proposed_change": "Add port door to the right side of the camera.",
   "severity": "major",
   "target": "Right-side hinged port door",
   "view": "right"
  }
 ],
 "judge_model": "openai:gpt-5+critic:gpt-4o",
 "metrics": {
  "deterministic_overall": 8.0,
  "deterministic_scores": {
   "colour_and_surface": 10.0,
   "pose_and_orientation": 8.0,
   "proportions": 7.0,
   "reference_consistency": 7.2,
   "signature_features": 8.62,
   "silhouette": 7.2
  },
  "features_named": {
   "Centered ISO-518 hot shoe on top plate": true,
   "Front viewfinder window at top-left": true,
   "Large knurled top dial": true,
   "Left-only textured rubber grip panel": true,
   "Right-offset cylindrical lens barrel": true,
   "Right-side hinged port door": true
  },
  "measured_proportions": {
   "height_length": 1.039,
   "length_width": 0.616
  },
  "method": "deterministic matched-view silhouette, proportion, outline-detail and palette metrics; names and labels earn no credit",
  "outline_detail_ratio": {
   "back": 0.896,
   "left": 0.467,
   "perspective": 0.769,
   "top": 0.488
  },
  "reference_silhouette_iou": {
   "back": 0.848,
   "left": 0.679,
   "perspective": 0.779,
   "top": 0.572
  },
  "silhouette_parts": [
   {
    "body_id": "top_plate",
    "protrudes": true,
    "volume_share": 0.1111
   },
   {
    "body_id": "bottom_plate",
    "protrudes": true,
    "volume_share": 0.101
   },
   {
    "body_id": "left_grip",
    "protrudes": true,
    "volume_share": 0.0297
   },
   {
    "body_id": "lens_barrel",
    "protrudes": true,
    "volume_share": 0.1732
   },
   {
    "body_id": "lens_glass",
    "protrudes": true,
    "volume_share": 0.0216
   },
   {
    "body_id": "viewfinder_bezel",
    "protrudes": true,
    "volume_share": 0.0022
   },
   {
    "body_id": "viewfinder_glass",
    "protrudes": true,
    "volume_share": 0.0008
   },
   {
    "body_id": "dial_left",
    "protrudes": true,
    "volume_share": 0.0129
   },
   {
    "body_id": "dial_right",
    "protrudes": true,
    "volume_share": 0.0108
   },
   {
    "body_id": "hot_shoe",
    "protrudes": true,
    "volume_share": 0.0097
   },
   {
    "body_id": "rear_screen",
    "protrudes": true,
    "volume_share": 0.0671
   },
   {
    "body_id": "port_door",
    "protrudes": true,
    "volume_share": 0.0148
   }
  ],
  "target_proportions": {}
 },
 "overall": 6.8,
 "render_digest": "d91403423577de4fa35c275dfe42dc7a4fe1e51b07e2d3f8c4c4a7b9c8fc8dca",
 "scores": {
  "colour_and_surface": 6.0,
  "pose_and_orientation": 9.0,
  "proportions": 7.0,
  "reference_consistency": 5.0,
  "signature_features": 6.0,
  "silhouette": 8.0
 },
 "subjective": true,
 "summary": "The render captures the compact, boxy silhouette with key features like the right-offset lens and left grip well. However, there are some inconsistencies, particularly with the inclusion and placement of the dials, the color scheme, and the presence of a dual dial on top."
}