{
 "issues": [
  {
   "body_id": "fuselage",
   "observed": "The fuselage is too cylindrical and lacks the needle-like taper specified in the brief.",
   "patch": null,
   "proposed_change": "Redesign the fuselage to have a more tapered nose.",
   "severity": "major",
   "target": "A streamlined, tapered fuselage",
   "view": "left"
  },
  {
   "body_id": "intake_left",
   "observed": "The left intake is not prominently asymmetrical nor oversized as required.",
   "patch": null,
   "proposed_change": "Increase the size and prominence of the left intake.",
   "severity": "major",
   "target": "A single oversized air intake on the left flank only",
   "view": "left"
  },
  {
   "body_id": "tail_fin",
   "observed": "The tail fin is not visible from key angles and lacks clarity.",
   "patch": null,
   "proposed_change": "Design a more visible, aerodynamically swept tail fin.",
   "severity": "major",
   "target": "A tall swept tail fin with aft rake",
   "view": "back"
  },
  {
   "body_id": "canopy",
   "observed": "The canopy lacks the set-back bubble form specified in the brief.",
   "patch": null,
   "proposed_change": "Modify the canopy to be a bubble-shaped, set-back design.",
   "severity": "critical",
   "target": "Bubble canopy set back from the nose",
   "view": "top"
  },
  {
   "body_id": "fuselage",
   "observed": "height:length is 0.49",
   "patch": {
    "factor": 0.77,
    "scale_axis": 1
   },
   "proposed_change": "scale Fuselage hull height by 0.77",
   "severity": "major",
   "target": "0.36 from the brief",
   "view": "front"
  }
 ],
 "judge_model": "openai:gpt-5+critic:gpt-4o",
 "metrics": {
  "deterministic_overall": 6.95,
  "deterministic_scores": {
   "colour_and_surface": 10.0,
   "pose_and_orientation": 8.0,
   "proportions": 6.03,
   "reference_consistency": 4.4,
   "signature_features": 8.17,
   "silhouette": 4.4
  },
  "features_named": {
   "Bubble canopy set back from the nose": true,
   "Long needle-like nose taper": false,
   "Single oversized air intake on the left flank only": true,
   "Tall swept tail fin with aft rake": true,
   "Three-point retractable landing skids (triangular stance)": true,
   "Twin rear thruster nozzles on centerline": true
  },
  "measured_proportions": {
   "height_length": 0.486,
   "length_width": 2.431
  },
  "method": "deterministic matched-view silhouette, proportion, outline-detail and palette metrics; names and labels earn no credit",
  "outline_detail_ratio": {
   "back": 0.748,
   "left": 0.401,
   "perspective": 0.324,
   "top": 0.698
  },
  "reference_silhouette_iou": {
   "back": 0.455,
   "left": 0.424,
   "perspective": 0.469,
   "top": 0.411
  },
  "silhouette_parts": [
   {
    "body_id": "canopy",
    "protrudes": true,
    "volume_share": 0.1135
   },
   {
    "body_id": "intake_left",
    "protrudes": true,
    "volume_share": 0.0056
   },
   {
    "body_id": "intake_right",
    "protrudes": true,
    "volume_share": 0.0056
   },
   {
    "body_id": "nozzle",
    "protrudes": true,
    "volume_share": 0.0228
   },
   {
    "body_id": "nozzle_glow",
    "protrudes": true,
    "volume_share": 0.0058
   },
   {
    "body_id": "tail_fin",
    "protrudes": true,
    "volume_share": 0.0016
   },
   {
    "body_id": "front_strut",
    "protrudes": true,
    "volume_share": 0.0047
   },
   {
    "body_id": "front_foot",
    "protrudes": true,
    "volume_share": 0.0003
   },
   {
    "body_id": "rear_left_strut",
    "protrudes": true,
    "volume_share": 0.0073
   },
   {
    "body_id": "rear_left_foot",
    "protrudes": true,
    "volume_share": 0.0004
   },
   {
    "body_id": "rear_right_strut",
    "protrudes": true,
    "volume_share": 0.0073
   },
   {
    "body_id": "rear_right_foot",
    "protrudes": true,
    "volume_share": 0.0004
   },
   {
    "body_id": "ventral_port_fwd",
    "protrudes": true,
    "volume_share": 0.0004
   },
   {
    "body_id": "ventral_port_aft",
    "protrudes": true,
    "volume_share": 0.0004
   }
  ],
  "target_proportions": {
   "height_length": 0.36,
   "length_width": 3.0
  }
 },
 "overall": 4.0,
 "render_digest": "4a6ba7573425ed221b52514605548da0ff965306dca5faa5bb18f83e272f0bc7",
 "scores": {
  "colour_and_surface": 6.0,
  "pose_and_orientation": 5.0,
  "proportions": 3.0,
  "reference_consistency": 3.0,
  "signature_features": 4.0,
  "silhouette": 4.0
 },
 "subjective": true,
 "summary": "The concept shows basic alignment with the brief but lacks several key features. The general shape lacks the required fineness and definition, particularly in the nose and intake areas. The surface appearance meets color expectations but lacks detail."
}