{
 "issues": [
  {
   "body_id": "fox_body",
   "observed": "The overall shape is too rough and lacks finesse.",
   "patch": null,
   "proposed_change": "Refine the silhouette to be smoother and more closely match the reference.",
   "severity": "major",
   "target": "Smooth transitions and details based on reference.",
   "view": "front"
  },
  {
   "body_id": "fox_body",
   "observed": "Proportions of the body elements are inconsistent with the reference.",
   "patch": null,
   "proposed_change": "Adjust the body elements to align more accurately with reference proportions.",
   "severity": "major",
   "target": "Proportions of the reference model.",
   "view": "left"
  },
  {
   "body_id": "fox_body",
   "observed": "Signature features such as the snout and ears are not clearly defined.",
   "patch": null,
   "proposed_change": "Enhance the defining features with more precise modeling.",
   "severity": "major",
   "target": "Raised narrow snout and sharp-pointed ears.",
   "view": "perspective"
  }
 ],
 "judge_model": "openai:gpt-5+critic:gpt-4o",
 "metrics": {
  "deterministic_overall": 6.38,
  "deterministic_scores": {
   "colour_and_surface": 10.0,
   "pose_and_orientation": 8.0,
   "proportions": 7.0,
   "reference_consistency": 5.51,
   "signature_features": 3.83,
   "silhouette": 5.51
  },
  "features_named": {
   "Bushy tail curling around the front paws": false,
   "Flat, slightly recessed base plane under haunches": true,
   "Plump oval torso with smooth transitions": false,
   "Raised, narrow snout projecting forward": false,
   "Two tall, sharp-pointed ears": false
  },
  "measured_proportions": {
   "height_length": 1.482,
   "length_width": 1.019
  },
  "method": "deterministic matched-view silhouette, proportion, outline-detail and palette metrics; names and labels earn no credit",
  "outline_detail_ratio": {
   "back": 0.875,
   "left": 0.862,
   "perspective": 0.489,
   "top": 0.406
  },
  "reference_silhouette_iou": {
   "back": 0.54,
   "left": 0.488,
   "perspective": 0.45,
   "top": 0.728
  },
  "silhouette_parts": [
   {
    "body_id": "base_pad",
    "protrudes": true,
    "volume_share": 0.02
   }
  ],
  "target_proportions": {}
 },
 "overall": 3.7,
 "render_digest": "ea1be36de3de163ff53bbfacbdf651bc71d0defee9e9874f9242c120b7fb6586",
 "scores": {
  "colour_and_surface": 4.0,
  "pose_and_orientation": 5.0,
  "proportions": 4.0,
  "reference_consistency": 3.0,
  "signature_features": 3.0,
  "silhouette": 3.0
 },
 "subjective": true,
 "summary": "The generated 3D fox figurine lacks refinement and doesn't fully align with the reference images. The overall shape is too rough, affecting the silhouette and signature features. Improvements are needed in smoothness and detail definition."
}